{
  "client": "04_delta-medical",
  "profile": "healthtech-pro-v11",
  "generated_at": "2026-04-21T11:30:33+00:00",
  "components": {
    "agents": [
      "SentinelHealthtechPharma.md",
      "HealthConsultant.md",
      "LegalCounsel.md",
      "SentinelProjectManagement.md"
    ],
    "subagents": [],
    "skills": [
      "healthtech-pharma-mastery.md",
      "health-data-privacy.md",
      "legal-brokerage-mastery.md"
    ],
    "commands": [
      "commands.md"
    ],
    "subcommands": [],
    "templates": [
      "PLAN_BLUEPRINT.md"
    ],
    "scripts": [
      "scripts-mastery.py"
    ]
  },
  "output_path": "/Users/Dorgham/Documents/Work/Devleopment/Sovereign/Sovereign Workspace Factory/workspaces/clients/04_delta-medical/01_clinical-trial-pipeline",
  "validation": {
    "status": "pending"
  }
}
